{
  "$schema": "https://raw.githubusercontent.com/qoo-oji/qooMeta/main/schema/examples.schema.json",
  "kind": "qoometa.examples",
  "schemaVersion": 2,
  "revision": "2026.09.19",
  "vocabulary": { "genres": ["種別A", "種別B", "種別C"] },
  "examples": [
    {
      "id": "parse-full-doujinshi-name",
      "files": ["(種別A) [架空工房 (山田太郎、佐藤花子)] 星降る夜の喫茶店 2 (オリジナル) [付録つき]"],
      "expect": [
        { "genre": "種別A", "event": null, "circle": "架空工房", "authors": ["山田太郎", "佐藤花子"],
          "title": "星降る夜の喫茶店 2", "relation": "オリジナル", "series": null }
      ],
      "covers": ["doujinshi"]
    },
    {
      "id": "parse-leading-paren-outside-vocabulary-is-event",
      "files": ["(架空祭7) [架空工房] 月の庭"],
      "expect": [{ "event": "架空祭7", "genre": null, "circle": "架空工房", "title": "月の庭" }],
      "covers": ["doujinshi"]
    },
    {
      "id": "parse-protected-year-is-not-relation",
      "files": ["(種別A) [架空工房] 月の庭 (2019)"],
      "expect": [{ "title": "月の庭 (2019)", "relation": null }],
      "covers": ["doujinshi"]
    },
    {
      "id": "parse-numeric-trailing-paren-is-volume",
      "files": ["(種別A) [架空工房] 月の庭 (12)", "(種別A) [架空工房] 月の庭 (13)"],
      "expect": [
        { "title": "月の庭 (12)", "relation": null, "series": "月の庭", "volume": "12" },
        { "title": "月の庭 (13)", "relation": null, "series": "月の庭", "volume": "13" }
      ],
      "covers": ["doujinshi", "number"]
    },
    {
      "id": "parse-full-width-brackets-keep-width",
      "files": ["［架空工房］ ＡＢＣの冒険！（オリジナル）"],
      "expect": [{ "circle": "架空工房", "title": "ＡＢＣの冒険！", "relation": "オリジナル" }],
      "covers": ["simpleBrackets"]
    },
    {
      "id": "parse-plain-name-is-whole-title",
      "files": ["ただのファイル名"],
      "expect": [{ "title": "ただのファイル名", "circle": null, "series": null }],
      "covers": ["simpleBrackets"]
    },
    {
      "id": "parse-edition-and-source-markers",
      "files": ["[架空工房] 月の庭【英語版】【特装版】", "[架空工房] 風の港 3 DL版", "[架空工房] 雨の窓【フルカラー版】"],
      "expect": [
        { "title": "月の庭【英語版】【特装版】", "editions": ["英語版"], "sources": ["特装版"] },
        { "editions": [], "sources": ["DL版"] },
        { "editions": ["フルカラー版"], "sources": [] }
      ],
      "covers": ["edition", "source"]
    },

    {
      "id": "unnumbered-first-volume-is-inferred",
      "files": ["[架空工房] 星降る夜の喫茶店", "[架空工房] 星降る夜の喫茶店 2", "[架空工房] 星降る夜の喫茶店 3"],
      "expect": [
        { "series": "星降る夜の喫茶店", "volume": "1", "volumeSort": 1, "inferred": true },
        { "series": "星降る夜の喫茶店", "volume": "2", "volumeSort": 2, "inferred": false },
        { "series": "星降る夜の喫茶店", "volume": "3", "volumeSort": 3, "inferred": false }
      ],
      "covers": ["volumeHead", "firstVolume", "unnumberedFirst"]
    },
    {
      "id": "subtitled-unnumbered-book-is-the-first",
      "files": ["[架空工房] 月影 はじまりの章", "[架空工房] 月影 2"],
      "expect": [
        { "series": "月影", "volumeSort": 1, "inferred": true },
        { "series": "月影", "volumeSort": 2 }
      ],
      "covers": ["volumeHead", "firstVolume", "subtitled"]
    },
    {
      "id": "title-equal-to-series-wins-among-unnumbered",
      "files": ["[架空工房] 星降る夜の喫茶店", "[架空工房] 星降る夜の喫茶店 冬の章", "[架空工房] 星降る夜の喫茶店 2"],
      "expect": [
        { "series": "星降る夜の喫茶店", "volumeSort": 1, "inferred": true },
        { "series": "星降る夜の喫茶店", "volume": null, "inferred": false },
        { "series": "星降る夜の喫茶店", "volumeSort": 2 }
      ],
      "covers": ["firstVolume"]
    },
    {
      "id": "not-inferred-when-two-subtitled-unnumbered",
      "files": ["[架空工房] 星降る夜の喫茶店 春の章", "[架空工房] 星降る夜の喫茶店 冬の章", "[架空工房] 星降る夜の喫茶店 2"],
      "expect": [{ "inferred": false, "volume": null }, { "inferred": false, "volume": null }, { "volumeSort": 2 }],
      "covers": ["firstVolume"]
    },
    {
      "id": "not-inferred-when-first-volume-exists",
      "files": ["[架空工房] 星降る夜の喫茶店", "[架空工房] 星降る夜の喫茶店 1", "[架空工房] 星降る夜の喫茶店 2"],
      "expect": [{ "inferred": false, "volume": null }, { "volumeSort": 1 }, { "volumeSort": 2 }],
      "covers": ["firstVolume"]
    },
    {
      "id": "not-inferred-for-not-first-marker",
      "files": ["[架空工房] 星降る夜の喫茶店 番外編", "[架空工房] 星降る夜の喫茶店 2"],
      "expect": [{ "inferred": false, "volume": null }, { "volumeSort": 2 }],
      "covers": ["firstVolume"]
    },
    {
      "id": "not-inferred-for-a-compilation",
      "files": ["[架空工房] 星降る夜の喫茶店 総集編", "[架空工房] 星降る夜の喫茶店 2"],
      "expect": [{ "inferred": false, "volume": null }, { "inferred": false }],
      "covers": ["firstVolume", "compilation"]
    },
    {
      "id": "not-inferred-for-not-first-prefix",
      "files": ["[架空工房] 雪鍋", "[架空工房] 雪鍋2", "[架空工房] 雪鍋exとっておき"],
      "expect": [
        { "series": "雪鍋", "volumeSort": 1, "inferred": true },
        { "series": "雪鍋", "volumeSort": 2 },
        { "series": "雪鍋", "volume": null, "inferred": false }
      ],
      "covers": ["firstVolume"]
    },
    {
      "id": "trailing-numbers-and-latin-suffix-join-the-series",
      "files": ["[架空工房] 雪鍋～小ネタ集～", "[架空工房] 雪鍋2～続き(仮)話 +おまけ1～", "[架空工房] 雪鍋3", "[架空工房] 雪鍋4", "[架空工房] 雪鍋exとっておき"],
      "expect": [
        { "series": "雪鍋", "volumeSort": 1, "inferred": true },
        { "series": "雪鍋", "volumeSort": 2 },
        { "series": "雪鍋", "volumeSort": 3 },
        { "series": "雪鍋", "volumeSort": 4 },
        { "series": "雪鍋", "volumeSort": null }
      ],
      "covers": ["volumeHead", "subtitled", "firstVolume"]
    },
    {
      "id": "variant-kanji-are-the-same-series",
      "files": ["[架空工房] 架空の凜", "[架空工房] 架空の凛2", "[架空工房] 架空の凛3"],
      "expect": [
        { "volumeSort": 1, "inferred": true },
        { "volumeSort": 2 },
        { "volumeSort": 3 }
      ],
      "covers": ["variants", "firstVolume"]
    },
    {
      "id": "leading-kanji-numerals-need-several-siblings",
      "files": ["[架空工房] 月の庭", "[架空工房] 月の庭 三つ星", "[架空工房] 月の庭 二つ灯"],
      "expect": [
        { "series": "月の庭", "volume": "1", "volumeSort": 1 },
        { "series": "月の庭", "volume": "三", "volumeSort": 3 },
        { "series": "月の庭", "volume": "二", "volumeSort": 2 }
      ],
      "covers": ["sharedLeadingKanji"]
    },
    {
      "id": "single-leading-kanji-is-an-ordinary-word",
      "files": ["[架空工房] 月の庭 2", "[架空工房] 月の庭 三人の夜"],
      "expect": [{ "volume": "2" }, { "volume": "1", "inferred": true }],
      "covers": ["sharedLeadingKanji", "firstVolume"]
    },

    {
      "id": "number-readers",
      "files": ["[架空工房] 月の庭 Vol.3", "[架空工房] 月の庭 第5話", "[架空工房] 月の庭 #4 おまけ", "[架空工房] 月の庭 ver2", "[架空工房] 月の庭 2つめ", "[架空工房] 月の庭 第3弾", "[架空工房] 月の庭 4冊目"],
      "expect": [
        { "series": "月の庭", "volume": "3", "volumeSort": 3 },
        { "series": "月の庭", "volume": "5", "volumeSort": 5 },
        { "series": "月の庭", "volume": "4", "volumeSort": 4 },
        { "series": "月の庭", "volume": "2", "volumeSort": 2 },
        { "series": "月の庭", "volume": "2", "volumeSort": 2 },
        { "series": "月の庭", "volume": "3", "volumeSort": 3 },
        { "series": "月の庭", "volume": "4", "volumeSort": 4 }
      ],
      "covers": ["number"]
    },
    {
      "id": "ver-is-a-volume-prefix",
      "files": ["[架空工房] 架空の写真 ver2", "[架空工房] 架空の写真 ver3"],
      "expect": [
        { "series": "架空の写真", "volumeSort": 2 },
        { "series": "架空の写真", "volumeSort": 3 }
      ],
      "covers": ["number", "dropLastWord"]
    },
    {
      "id": "ver-without-space-after-exclamation",
      "files": ["[架空工房] 架空録! ver1", "[架空工房] 架空録! ver2"],
      "expect": [{ "series": "架空録!", "volumeSort": 1 }, { "series": "架空録!", "volumeSort": 2 }],
      "covers": ["number", "includeFollowing"]
    },
    {
      "id": "ver-glued-to-the-name",
      "files": ["[架空工房] 架空録ver.48", "[架空工房] 架空録ver.特別"],
      "expect": [{ "series": "架空録", "volumeSort": 48 }, { "series": "架空録" }],
      "covers": ["number"]
    },
    {
      "id": "ordinal-with-any-counter",
      "files": ["[架空工房] 月の庭 第1幕", "[架空工房] 月の庭 第2幕", "[架空工房] 月の庭 第三部 完結"],
      "expect": [
        { "series": "月の庭", "volumeSort": 1 },
        { "series": "月の庭", "volumeSort": 2 },
        { "series": "月の庭", "volume": "三", "volumeSort": 3 }
      ],
      "covers": ["ordinal"]
    },
    {
      "id": "split-chapters",
      "files": ["[架空工房] 月の庭 第04-1章", "[架空工房] 月の庭 第04-2章", "[架空工房] 月の庭 第19-1章", "[架空工房] 月の庭 第19-2章"],
      "expect": [
        { "series": "月の庭", "volume": "04-1", "volumeSort": 4.1 },
        { "series": "月の庭", "volume": "04-2", "volumeSort": 4.2 },
        { "series": "月の庭", "volume": "19-1", "volumeSort": 19.1 },
        { "series": "月の庭", "volume": "19-2", "volumeSort": 19.2 }
      ],
      "covers": ["ordinal"]
    },
    {
      "id": "kanji-numerals-with-prefixes",
      "files": ["[架空工房] 月の庭 其ノ二", "[架空工房] 月の庭 其ノ三", "[架空工房] 月の庭 其の四", "[架空工房] 月の庭 ソノ5", "[架空工房] 月の庭 第十二巻", "[架空工房] 月の庭 第弐拾巻"],
      "expect": [
        { "series": "月の庭", "volume": "二", "volumeSort": 2 },
        { "series": "月の庭", "volume": "三", "volumeSort": 3 },
        { "series": "月の庭", "volume": "四", "volumeSort": 4 },
        { "series": "月の庭", "volume": "5", "volumeSort": 5 },
        { "series": "月の庭", "volume": "十二", "volumeSort": 12 },
        { "series": "月の庭", "volume": "弐拾", "volumeSort": 20 }
      ],
      "covers": ["kanji", "number"]
    },
    {
      "id": "roman-numerals",
      "files": ["[架空工房] 月の庭 I", "[架空工房] 月の庭 II", "[架空工房] 月の庭 Ⅲ"],
      "expect": [
        { "series": "月の庭", "volumeSort": 1 },
        { "series": "月の庭", "volumeSort": 2 },
        { "series": "月の庭", "volumeSort": 3 }
      ],
      "covers": ["roman"]
    },
    {
      "id": "inferred-first-follows-roman",
      "files": ["[架空工房] 月の庭", "[架空工房] 月の庭 II", "[架空工房] 月の庭 III"],
      "expect": [{ "volume": "I", "inferred": true }, { "volume": "II" }, { "volume": "III" }],
      "covers": ["roman", "firstVolume"]
    },
    {
      "id": "inferred-first-follows-zero-padding",
      "files": ["[架空工房] 架空録 総集編 02", "[架空工房] 架空録 総集編 03", "[架空工房] 架空録 総集編"],
      "expect": [
        { "series": "架空録 総集編", "volume": "02" },
        { "series": "架空録 総集編", "volume": "03" },